{
  "schemaVersion": "agent-eval-repo-change-runner-check-record-1",
  "id": "repo-change-runner-check-fixture-1",
  "version": "0.1.0",
  "experimentId": "experiment-fixture-1",
  "caseId": "repo-change-case-fixture-1",
  "cellId": "cell-fixture-1",
  "attemptId": "attempt-fixture-1",
  "armId": "arm-fixture-1",
  "workspaceManifestDigest": "sha256:e100fec3cc4a6d4b2d069fd2e9e5c81eb4f3bca59ec7db69152141e2b1458cd5",
  "workspaceRootDigest": "sha256:675204f42738625d104c09671bae121d5e82722f71ba62e7c6dd75a5653430ac",
  "validationPlanDigest": "sha256:ace3b579bc72bd400b848c2b068f45f1a55516a36aea2a999abcf066ffa3f972",
  "subjectKind": "workspace_state",
  "subjectDigest": "sha256:675204f42738625d104c09671bae121d5e82722f71ba62e7c6dd75a5653430ac",
  "checks": [
    {
      "id": "hidden-functional-check",
      "contractDigest": "sha256:3232323232323232323232323232323232323232323232323232323232323232",
      "status": "invalid"
    },
    {
      "id": "security-check",
      "contractDigest": "sha256:3434343434343434343434343434343434343434343434343434343434343434",
      "status": "pass"
    },
    {
      "id": "control-proof",
      "contractDigest": "sha256:3636363636363636363636363636363636363636363636363636363636363636",
      "status": "pass"
    }
  ],
  "overallVerdict": "invalid"
}
